<?xml version="1.0" encoding="UTF-8"?>
<!DOCTYPE ei-config SYSTEM "../../ei-config.dtd">
<ei-config>
<jade-parameters>
<parameter>local-port=2011</parameter>
</jade-parameters>

<institutional-agents>

<agent name="rma">
<class>jade.tools.rma.rma</class>
</agent>

<agent name="Bidder1">
	<class>Bidder</class> 
	<argument>role=IR-enterprise-agent</argument>
	<argument>bid=1000</argument>
</agent>
<agent name="Bidder2">
	<class>Bidder</class> 
	<argument>role=IR-enterprise-agent</argument>
	<argument>bid=2000</argument>
</agent>
<agent name="Bidder3">
	<class>Bidder</class> 
	<argument>role=IR-enterprise-agent</argument>
	<argument>bid=3000</argument>
</agent>
<agent name="Bidder4">
	<class>Bidder</class> 
	<argument>role=IR-enterprise-agent</argument>
	<argument>bid=4000</argument>
</agent>
<agent name="Auctioneer">
		<class>VickreyNegotiationFacilitator</class>
		<argument>service=IS-negotiation-facilitator</argument>
</agent>

<!-- <agent name="Seller"> -->
<!-- 		<class>Seller</class> -->
<!-- 		<argument>role=IR-enterprise-agent</argument> -->
		
<!-- </agent> -->

</institutional-agents>
</ei-config>
